{
  "$schema": "https://json-schema.org/draft/2020-12/schema",
  "$id": "https://spec.consiliency/spec-parity/result-state.schema.json",
  "title": "Parity result state + per-dimension result + finding (Phase 3a)",
  "description": "The result-state enum and the structures that carry it: per-dimension results and machine-readable findings. See SEMANTICS.md sec 6 (states) and sec 7 (dimensions). NO JSON FLOATS anywhere (canon v1 sec 6 forbids them): confidence/score fields are string-decimals.",
  "$defs": {
    "result_state": {
      "title": "result_state",
      "description": "The verbatim v1 contract enum. pass: in-scope check applicable, fact observed, no violation. fail: in-scope violation OBSERVED. unknown: in-scope and applicable, but the required fact was NOT OBSERVABLE in this E(C) (data absent) -- the anti-silent-pass guard. unsupported: the CHECKER cannot ask the question (capability gap: unmapped kind, dimension not implemented for this entity class). not_applicable: no subject exists (vacuous; labeled so it is not counted as an evaluated pass).",
      "enum": ["pass", "fail", "unknown", "unsupported", "not_applicable"]
    },
    "parity_dimension": {
      "title": "parity_dimension",
      "enum": ["completeness", "soundness", "closure", "prohibition", "revision_alignment", "acceptance"]
    },
    "string_decimal": {
      "title": "string_decimal",
      "description": "A decimal in [0,1] as a STRING (canon forbids JSON floats). Pattern allows 0, 1, and 0.xxx forms.",
      "type": "string",
      "pattern": "^(0|1|0\\.[0-9]+|1\\.0+)$"
    },
    "finding": {
      "title": "finding",
      "type": "object",
      "additionalProperties": false,
      "required": ["finding_id", "dimension", "result_state", "code", "subject"],
      "properties": {
        "finding_id": { "type": "string", "description": "Stable id of this finding: canon semantic-content digest over the explicit content subset {dimension, result_state, code, subject} (NOT the whole record -- message/evidence_refs/confidence/waiver_ref are excluded so a re-worded message or an added waiver does not mint a new finding identity). Named-subset preimage, like waiver_id, to avoid relying on canon sec 8 for a nested id." },
        "dimension": { "$ref": "#/$defs/parity_dimension" },
        "result_state": { "$ref": "#/$defs/result_state" },
        "acceptance_result": { "$ref": "#/$defs/acceptance_result", "description": "Acceptance command result with its authority, including pass observations." },
        "code": {
          "type": "string",
          "description": "A stable machine code for the finding class, e.g. missing_desired_element, structural_mismatch, kind_mismatch, signature_unobservable, prohibition_violated, prohibition_unobservable, prohibition_outside_default_closure, acceptance_command_pass, acceptance_command_fail, acceptance_unobserved, acceptance_pipeline_unengaged, unmapped_realized_kind, unmapped_desired_kind, ambiguous_kind_alignment, refinement_below_frontier, permitted_freedom, correspondence_ambiguous, capability_missing. Retired codes (never emitted by the current projection_algo_version, kept readable in older records): signature_undeclared (retired in spec-engine-projection:v4)."
        },
        "subject": {
          "type": "object",
          "description": "What the finding is about.",
          "additionalProperties": false,
          "properties": {
            "desired_logical_id": { "type": "string", "description": "idmodel Tier-1 logical_id of the desired element, if any." },
            "realized_occurrence_id": { "type": "string", "description": "idmodel Tier-2 occurrence_id of the realized fact, if any." },
            "desired_kind": { "type": "string" },
            "realized_kind": { "type": "string" },
            "realized_source": { "type": "string" }
          }
        },
        "message": { "type": "string", "description": "Human-readable explanation (NOT hashed-meaning-bearing on its own; the code+subject are the load-bearing identity)." },
        "evidence_refs": {
          "type": "array",
          "description": "Span-anchored / digest-anchored evidence pointers (SSRF-safe refs, not payloads).",
          "items": { "type": "object" }
        },
        "confidence": { "$ref": "#/$defs/string_decimal", "description": "Optional. STRING decimal only; never a JSON float." },
        "waiver_ref": { "type": "string", "description": "If this finding is currently suppressed by a waiver, the waiver_id. A waiver does NOT change result_state to pass; it only records suppression (SEMANTICS.md sec 8)." }
      },
      "allOf": [{ "if": { "properties": { "dimension": { "const": "acceptance" } } }, "then": { "required": ["acceptance_result"] }, "else": { "not": { "required": ["acceptance_result"] } } }]
    },
    "dimension_result": {
      "title": "dimension_result",
      "type": "object",
      "additionalProperties": false,
      "required": ["dimension", "result_state"],
      "properties": {
        "dimension": { "$ref": "#/$defs/parity_dimension" },
        "result_state": { "$ref": "#/$defs/result_state" },
        "checks_evaluated": { "type": "integer", "minimum": 0, "description": "Count of in-scope checks evaluated for this dimension. A real JSON integer (canon sec 6 supports arbitrary-precision integers as JSON integers; the `$int`-tag is the test-vector encoding only, never the data model). Only FLOATS are forbidden, not integers." },
        "finding_ids": { "type": "array", "items": { "type": "string" }, "description": "finding_ids contributing to this dimension's state." },
        "acceptance_results": { "type": "array", "items": { "$ref": "#/$defs/acceptance_result" }, "description": "For acceptance: one per in-scope criterion, sorted by criterion_logical_id. Authority is pinned beside every state, including passes." }
      },
      "allOf": [{ "if": { "properties": { "dimension": { "const": "acceptance" } } }, "then": { "required": ["acceptance_results"] }, "else": { "not": { "required": ["acceptance_results"] } } }]
    },
    "acceptance_result": {
      "type": "object",
      "additionalProperties": false,
      "required": ["criterion_logical_id", "result_state", "authority", "verdict_role"],
      "properties": {
        "criterion_logical_id": { "type": "string", "pattern": "^[0-9a-f]{64}$" },
        "result_state": { "enum": ["pass", "fail", "unknown"] },
        "authority": { "enum": ["producer", "pipeline", null], "description": "producer: the run that executed the command owns its result; pipeline: an external acceptance authority owns the truth and this result is input to it; null: no record (SEMANTICS sec 7.6)." },
        "authority_id": { "type": "string", "pattern": "^[a-z0-9][a-z0-9._/-]{0,127}(?![\\s\\S])", "description": "Copied unchanged from the evidence record when it carries one; never interpreted." },
        "verdict_role": { "enum": ["run_verdict", "pipeline_input", "unobserved"] },
        "pipeline_mode": { "enum": ["standalone", "pipeline_optional", "pipeline_required"] },
        "pipeline_engaged": { "type": "boolean" },
        "record_digest": { "type": "string", "pattern": "^[0-9a-f]{64}$", "description": "canon semantic-content digest of the exact E(C) evidence record." }
      },
      "oneOf": [
        { "properties": { "result_state": { "const": "unknown" }, "authority": { "const": null }, "verdict_role": { "const": "unobserved" } }, "not": { "anyOf": [{ "required": ["pipeline_mode"] }, { "required": ["pipeline_engaged"] }, { "required": ["record_digest"] }, { "required": ["authority_id"] }] } },
        { "required": ["pipeline_mode", "pipeline_engaged", "record_digest"], "properties": { "result_state": { "enum": ["pass", "fail"] }, "authority": { "const": "producer" }, "verdict_role": { "const": "run_verdict" }, "pipeline_mode": { "enum": ["standalone", "pipeline_optional"] }, "pipeline_engaged": { "const": false } } },
        { "required": ["pipeline_mode", "pipeline_engaged", "record_digest"], "properties": { "result_state": { "enum": ["pass", "fail"] }, "authority": { "const": "pipeline" }, "verdict_role": { "const": "pipeline_input" }, "pipeline_mode": { "enum": ["pipeline_optional", "pipeline_required"] }, "pipeline_engaged": { "const": true } } },
        { "required": ["pipeline_mode", "pipeline_engaged", "record_digest"], "description": "A pipeline_required record whose pipeline did not engage: the pipeline never ruled, so the state is unknown whatever the command exited (SEMANTICS sec 7.6, finding code acceptance_pipeline_unengaged). Authority and role stay pipeline / pipeline_input.", "properties": { "result_state": { "const": "unknown" }, "authority": { "const": "pipeline" }, "verdict_role": { "const": "pipeline_input" }, "pipeline_mode": { "const": "pipeline_required" }, "pipeline_engaged": { "const": false } } }
      ]
    },
    "extraction_coverage_summary": {
      "title": "extraction_coverage_summary",
      "description": "The summary of an E(C) extraction that was NOT fully observed, pinned on a finding_set / certificate / vacuity record so the result can never present as full coverage (SEMANTICS sec 4.2). `partial`: the realized adapter MEASURED holes (E(C) extraction_coverage: tsc files it could not parse, source files on disk it never listed, files whose tree-sitter tree has ERROR/MISSING nodes, uncompiled .proto files) — the counts are copied from that record. `unmeasured`: the E(C) carries an extraction_coverage that is not a measurement. Absent when the extraction was measured full, or when the E(C) declares no extraction_coverage at all (a hand-authored fixture whose modeled_domains declaration stands).",
      "type": "object",
      "additionalProperties": false,
      "required": ["status"],
      "properties": {
        "status": { "enum": ["partial", "unmeasured"] },
        "files_total": { "type": "integer", "minimum": 0, "description": "Source files the extractor saw or should have seen." },
        "files_extracted": { "type": "integer", "minimum": 0, "description": "Files parsed with no syntax error and no attributed diagnostic." },
        "unextracted_count": { "type": "integer", "minimum": 0, "description": "Length of E(C) extraction_coverage.unextracted." },
        "unattributed_diagnostic_count": { "type": "integer", "minimum": 0, "description": "Run-level extractor diagnostics not attributable to a listed file." }
      }
    }
  },
  "type": "object",
  "title": "finding_set",
  "description": "The machine-readable finding set emitted by N(). Referenced by certificate.findings_ref.",
  "additionalProperties": false,
  "required": ["finding_set_id", "dimension_results", "findings", "overall_result_state"],
  "properties": {
    "finding_set_id": { "type": "string", "description": "canon semantic-content digest over {dimension_results, findings} (sorted/canonicalized)." },
    "overall_result_state": {
      "$ref": "#/$defs/result_state",
      "description": "Aggregated per the severity rule in SEMANTICS.md sec 6.4: fail if any dimension fails; else unknown if any unknown; else unsupported if any unsupported; else pass. not_applicable is neutral (does not count)."
    },
    "dimension_results": {
      "type": "array",
      "items": { "$ref": "#/$defs/dimension_result" },
      "minItems": 5,
      "maxItems": 6,
      "description": "Exactly one entry per parity_dimension: six in projection v5, five in historical v1-v4 records. A dimension with no subject reports not_applicable."
    },
    "findings": {
      "type": "array",
      "items": { "$ref": "#/$defs/finding" }
    },
    "vacuity": {
      "type": "object",
      "description": "OPTIONAL. Present (and is_vacuous=true) ONLY when the certify VACUITY TRIPWIRE fired: E(C) had NO kind-aligned realized boundary, so there was no real code to certify and overall_result_state is not_applicable across every dimension. This block is the load-bearing DISTINCTION from an ordinary single-revision not_applicable; it makes a refusal-over-noise honest rather than a fake-green. Absent on every non-vacuous finding_set (so existing artifacts are byte-identical). NOT part of the finding_set_id preimage (which digests {dimension_results, findings} only); pinned instead by the certificate digest.",
      "additionalProperties": false,
      "required": ["is_vacuous", "reason", "realized_boundary_count", "kind_aligned_realized_count"],
      "properties": {
        "is_vacuous": { "const": true },
        "reason": { "type": "string", "description": "Machine code for why the certify was vacuous, e.g. no_kind_aligned_realized_boundary." },
        "realized_boundary_count": { "type": "integer", "minimum": 0, "description": "Total E(C) boundary count (may be >0 even when vacuous — e.g. config-file noise boundaries)." },
        "kind_aligned_realized_count": { "type": "integer", "minimum": 0, "const": 0, "description": "Count of E(C) boundaries that map to a desired kind via kind-alignment; 0 is exactly the vacuity condition." },
        "extraction_coverage": { "$ref": "#/$defs/extraction_coverage_summary", "description": "Present when the vacuous E(C)'s extraction was partial or unmeasured — it says WHY there is no code (e.g. every source file an unsupported extension, or unparseable). SEMANTICS sec 4.2." }
      }
    },
    "extraction_coverage": {
      "$ref": "#/$defs/extraction_coverage_summary",
      "description": "OPTIONAL. Present ONLY when E(C)'s extraction was partial or unmeasured (SEMANTICS sec 4.2); then no prohibition passes, a completeness absence is unknown, and closure carries an unknown closure_extraction_partial check. NOT part of the finding_set_id preimage; pinned by the certificate digest (certificate.extraction_coverage mirrors it)."
    }
  }
}
