{
  "finding_set_id": "933662f6df6d3bb6bc581b6c88e5897f2f6b6d5514bf56c9263cfc5bc5c5ccf0",
  "overall_result_state": "pass",
  "dimension_results": [
    {
      "dimension": "completeness",
      "result_state": "pass",
      "checks_evaluated": 2,
      "finding_ids": []
    },
    {
      "dimension": "soundness",
      "result_state": "pass",
      "checks_evaluated": 2,
      "finding_ids": [
        "a106507bfad328783fa0e3d3bc9a2fc913753a8c1c7a40c434052786edbbf08c"
      ]
    },
    {
      "dimension": "closure",
      "result_state": "pass",
      "checks_evaluated": 2,
      "finding_ids": []
    },
    {
      "dimension": "prohibition",
      "result_state": "not_applicable",
      "checks_evaluated": 0,
      "finding_ids": []
    },
    {
      "dimension": "revision_alignment",
      "result_state": "not_applicable",
      "checks_evaluated": 0,
      "finding_ids": []
    },
    {
      "dimension": "acceptance",
      "result_state": "not_applicable",
      "checks_evaluated": 0,
      "finding_ids": [],
      "acceptance_results": []
    }
  ],
  "findings": [
    {
      "finding_id": "a106507bfad328783fa0e3d3bc9a2fc913753a8c1c7a40c434052786edbbf08c",
      "dimension": "soundness",
      "result_state": "pass",
      "code": "permitted_freedom",
      "subject": {
        "desired_logical_id": "f19715d315eeda770a839cfbedbd8655f8e30ab52f2d59c04d94cbaac6047086",
        "realized_occurrence_id": "75ddf9f3fdefc03aa3bbde9be81a988f2fdc08d788ad0747d02164d6633c7958",
        "desired_kind": "interface",
        "realized_kind": "interface"
      },
      "message": "realized signature extends the declared one (trailing params); permitted by token rule_kind allow_signature_superset"
    }
  ]
}
